<!--
  ~ Copyright (C) 2001-2016 Food and Agriculture Organization of the
  ~ United Nations (FAO-UN), United Nations World Food Programme (WFP)
  ~ and United Nations Environment Programme (UNEP)
  ~
  ~ This program is free software; you can redistribute it and/or modify
  ~ it under the terms of the GNU General Public License as published by
  ~ the Free Software Foundation; either version 2 of the License, or (at
  ~ your option) any later version.
  ~
  ~ This program is distributed in the hope that it will be useful, but
  ~ WITHOUT ANY WARRANTY; without even the implied warranty of
  ~ MERCHANTABILITY or FITNESS FOR A PARTICULAR PURPOSE. See the GNU
  ~ General Public License for more details.
  ~
  ~ You should have received a copy of the GNU General Public License
  ~ along with this program; if not, write to the Free Software
  ~ Foundation, Inc., 51 Franklin St, Fifth Floor, Boston, MA 02110-1301, USA
  ~
  ~ Contact: Jeroen Ticheler - FAO - Viale delle Terme di Caracalla 2,
  ~ Rome - Italy. email: geonetwork@osgeo.org
  -->

<sources xmlns:xsi="http://www.w3.org/2001/XMLSchema-instance"
         xsi:noNamespaceSchemaLocation="../../../../../../web/src/main/webapp/WEB-INF/wro-sources.xsd">
  <require pathOnDisk="web-ui/src/main/resources">
    <jsSource webappPath="/catalog/js/"/>
    <jsSource webappPath="/catalog/views/"/>
    <jsSource webappPath="/catalog/components/"/>
    <jsSource webappPath="/catalog/templates/"/>
    <cssSource webappPath="/catalog/views/"/>
    <cssSource webappPath="/catalog/style/"/>
    <cssSource webappPath="/catalog/lib/bootstrap-table/dist/bootstrap-table.min.css" />
  </require>
  <declarative name="lib" pathOnDisk="web-ui/src/main/resources">
    <jsSource webappPath="/catalog/lib/modernizr.js" minimize="false"/>
    <jsSource webappPath="/catalog/lib/jquery-3.7.1.js" minimize="true"/>
    <jsSource webappPath="/catalog/lib/jquery-migrate-mute.js" minimize="false"/>
    <jsSource webappPath="/catalog/lib/jquery-migrate-3.6.0.js" minimize="false"/>
    <jsSource webappPath="/catalog/lib/moment-with-locales.min.js" minimize="false"/>
    <jsSource webappPath="/catalog/lib/moment-timezone-with-data-1970-2030.min.js" minimize="false" />
    <jsSource webappPath="/catalog/lib/angular/angular.min.js" minimize="false"/>
    <jsSource webappPath="/catalog/lib/angular-filter.min.js" minimize="false"/>
    <jsSource webappPath="/catalog/lib/angular/angular-resource.min.js" minimize="false"/>
    <jsSource webappPath="/catalog/lib/angular/angular-route.min.js" minimize="false"/>
    <jsSource webappPath="/catalog/lib/angular/angular-sanitize.min.js" minimize="false"/>
    <jsSource webappPath="/catalog/lib/angular/angular-cookies.min.js" minimize="false"/>
    <jsSource webappPath="/catalog/lib/angular/angular-messages.min.js" minimize="false"/>
    <jsSource webappPath="/catalog/lib/angular-translate.min.js" minimize="false"/>
    <jsSource webappPath="/catalog/lib/angular-md5.min.js" minimize="false"/>
    <jsSource webappPath="/catalog/lib/angular.ext/hotkeys/hotkeys.min.js" minimize="false"/>
    <jsSource webappPath="/catalog/lib/angular.ext/bindHtml.js"/>
    <jsSource webappPath="/catalog/lib/angular.ext/buttons.js"/>
    <jsSource webappPath="/catalog/lib/angular.ext/datetimepicker.js"/>
    <jsSource webappPath="/catalog/lib/angular.ext/modal.js"/>
    <jsSource webappPath="/catalog/lib/angular.ext/position.js"/>
    <jsSource webappPath="/catalog/lib/angular.ext/slider.js"/>
    <jsSource webappPath="/catalog/lib/angular.ext/rating.js"/>
    <jsSource webappPath="/catalog/lib/angular.ext/tabs.js"/>
    <jsSource webappPath="/catalog/lib/angular.ext/typeahead.js"/>
    <jsSource webappPath="/catalog/lib/angular.ext/colorpicker/angularjs-color-picker.js"/>
    <jsSource webappPath="/catalog/lib/angular.ext/date.js"/>
    <jsSource webappPath="/catalog/lib/angular.ext/angular-floatThead.js"/>
    <jsSource webappPath="/catalog/lib/tinycolor.js"/>
    <jsSource webappPath="/catalog/lib/franc-min/franc-min.js"/>
    <jsSource webappPath="/catalog/lib/bootstrap.js" minimize="true"/>
    <jsSource webappPath="/catalog/lib/proj4js-compressed.js" minimize="false"/>
    <jsSource webappPath="/catalog/lib/openlayers/ol.js" minimize="false"/>
    <jsSource webappPath="/catalog/lib/d3.v3.min.js" minimize="false"/>
    <jsSource webappPath="/catalog/lib/nv.d3.min.js" minimize="false"/>
    <jsSource webappPath="/catalog/lib/jsonix/jsonix/Jsonix-min.js" minimize="false"/>
    <jsSource webappPath="/catalog/lib/jquery.ext/jquery.ui.widget.js"/>
    <jsSource webappPath="/catalog/lib/jquery.ext/jquery.iframe-transport.js"/>
    <jsSource webappPath="/catalog/lib/jquery.ext/jquery.fileupload.js"/>
    <jsSource webappPath="/catalog/lib/jquery.ext/jquery.fileupload-process.js"/>
    <jsSource webappPath="/catalog/lib/jquery.ext/jquery.fileupload-angular.js"/>
    <jsSource webappPath="/catalog/lib/jquery.ext/jquery.floatThead-slim.min.js"/>
    <jsSource webappPath="/catalog/lib/jquery.ext/jquery-ui-slider-1.13.2.min.js" minimize="false"/>
    <jsSource webappPath="/catalog/lib/bootstrap.ext/typeahead.js/typeahead.bundle.js"/>
    <jsSource webappPath="/catalog/lib/bootstrap.ext/tagsinput/bootstrap-tagsinput.min.js"
              minimize="false"/>
    <jsSource webappPath="/catalog/lib/bootstrap.ext/tagsinput/bootstrap-tagsinput-angular.js"/>
    <jsSource webappPath="/catalog/lib/bootstrap.ext/datepicker/bootstrap-datepicker.js" minimize="true"/>
    <jsSource webappPath="/catalog/lib/bootstrap.ext/datepicker/bootstrap-datepicker.fr.min.js" minimize="false"/>
    <jsSource webappPath="/catalog/lib/bootstrap.ext/datepicker/bootstrap-datepicker.nl.min.js" minimize="false"/>
    <jsSource webappPath="/catalog/lib/bootstrap.ext/datepicker/bootstrap-datepicker.az.min.js" minimize="false"/>
    <jsSource webappPath="/catalog/lib/bootstrap.ext/datepicker/bootstrap-datepicker.ca.min.js" minimize="false"/>
    <jsSource webappPath="/catalog/lib/bootstrap.ext/datepicker/bootstrap-datepicker.cs.min.js" minimize="false"/>
    <jsSource webappPath="/catalog/lib/bootstrap.ext/datepicker/bootstrap-datepicker.cy.min.js" minimize="false"/>
    <jsSource webappPath="/catalog/lib/bootstrap.ext/datepicker/bootstrap-datepicker.da.min.js" minimize="false"/>
    <jsSource webappPath="/catalog/lib/bootstrap.ext/datepicker/bootstrap-datepicker.de.min.js" minimize="false"/>
    <jsSource webappPath="/catalog/lib/bootstrap.ext/datepicker/bootstrap-datepicker.es.min.js" minimize="false"/>
    <jsSource webappPath="/catalog/lib/bootstrap.ext/datepicker/bootstrap-datepicker.fi.min.js" minimize="false"/>
    <jsSource webappPath="/catalog/lib/bootstrap.ext/datepicker/bootstrap-datepicker.hy.min.js" minimize="false"/>
    <jsSource webappPath="/catalog/lib/bootstrap.ext/datepicker/bootstrap-datepicker.is.min.js" minimize="false"/>
    <jsSource webappPath="/catalog/lib/bootstrap.ext/datepicker/bootstrap-datepicker.it.min.js" minimize="false"/>
    <jsSource webappPath="/catalog/lib/bootstrap.ext/datepicker/bootstrap-datepicker.ka.min.js" minimize="false"/>
    <jsSource webappPath="/catalog/lib/bootstrap.ext/datepicker/bootstrap-datepicker.ko.min.js" minimize="false"/>
    <jsSource webappPath="/catalog/lib/bootstrap.ext/datepicker/bootstrap-datepicker.pt.min.js" minimize="false"/>
    <jsSource webappPath="/catalog/lib/bootstrap.ext/datepicker/bootstrap-datepicker.ro.min.js" minimize="false"/>
    <jsSource webappPath="/catalog/lib/bootstrap.ext/datepicker/bootstrap-datepicker.ru.min.js" minimize="false"/>
    <jsSource webappPath="/catalog/lib/bootstrap.ext/datepicker/bootstrap-datepicker.sk.min.js" minimize="false"/>
    <jsSource webappPath="/catalog/lib/bootstrap.ext/datepicker/bootstrap-datepicker.sv.min.js" minimize="false"/>
    <jsSource webappPath="/catalog/lib/bootstrap.ext/datepicker/bootstrap-datepicker.uk.min.js" minimize="false"/>
    <jsSource webappPath="/catalog/lib/bootstrap.ext/datepicker/bootstrap-datepicker.zh.min.js" minimize="false"/>
    <jsSource webappPath="/catalog/lib/bootstrap-table/dist/bootstrap-table.min.js"
              minimize="false"/>
    <jsSource webappPath="/catalog/lib/bootstrap-table/dist/bootstrap-table-locale-all.min.js"
              minimize="false"/>
    <jsSource webappPath="/catalog/lib/bootstrap-table-angular.js"
              minimize="false"/>
    <jsSource webappPath="/catalog/lib/FileSaver/FileSaver.min.js" minimize="false"/>
    <jsSource webappPath="/catalog/lib/tableExport/tableExport.min.js" minimize="false"/>
    <jsSource webappPath="/catalog/lib/bootstrap-table/dist/extensions/export/bootstrap-table-export.js" minimize="false"/>
    <jsSource webappPath="/catalog/lib/bootstrap-table/dist/extensions/filter-control/bootstrap-table-filter-control.min.js" />
    <jsSource webappPath="/catalog/lib/zip/zip.js"/>
    <jsSource webappPath="/catalog/lib/zip/include.js"/>
    <jsSource webappPath="/catalog/lib/base64.js"/>
    <jsSource webappPath="/catalog/lib/lodash/lodash.min.js" minimize="false"/>
    <jsSource webappPath="/catalog/lib/recaptcha/angular-recaptcha.min.js" minimize="false"/>
    <jsSource webappPath="/catalog/lib/geohash.js"/>
    <jsSource webappPath="/catalog/lib/xml2json/xml2json.min.js" minimize="false"/>
  </declarative>
  <!-- Same as previous + olcesium -->
  <declarative name="lib3d" pathOnDisk="web-ui/src/main/resources">
    <jsSource webappPath="/catalog/lib/modernizr.js" minimize="false"/>
    <jsSource webappPath="/catalog/lib/jquery-3.7.1.js" minimize="true"/>
    <jsSource webappPath="/catalog/lib/jquery-migrate-mute.js" minimize="false"/>
    <jsSource webappPath="/catalog/lib/jquery-migrate-3.6.0.js" minimize="false"/>
    <jsSource webappPath="/catalog/lib/moment-with-locales.min.js" minimize="false"/>
    <jsSource webappPath="/catalog/lib/moment-timezone-with-data-1970-2030.min.js" minimize="false" />
    <jsSource webappPath="/catalog/lib/angular/angular.min.js" minimize="false"/>